{
  "member_no": "mem-0001",
  "display_name": "Member 0001",
  "status": "admitted",
  "batch_id": "batch-0001",
  "role_names": [
    "正式成员"
  ],
  "roles": [
    {
      "role_assignment_id": 1,
      "role_id": 1,
      "role": "成员资格与职责 - 正式成员",
      "role_name": "正式成员",
      "organization_name": "成员资格与职责"
    }
  ],
  "role_name": "正式成员",
  "joined_simulation_day": 1,
  "credit_floor": -300,
  "profile": {
    "health": 82,
    "stamina": 76,
    "fatigue": 18,
    "satisfaction": 64,
    "fairness_sensitivity": 71,
    "public_spirit": 68,
    "rule_compliance": 74,
    "exit_risk": 8,
    "skills": {
      "cooking": 62,
      "cleaning": 55
    }
  },
  "created_at": "2026-05-24T00:00:00Z"
}
